[
  {
    "version_id": "1.0A",
    "target_end_date": "2020-10-19",
    "selected_timestamp": null,
    "archive_url": null,
    "selection_reason": "none_found_before_end_date",
    "quality_flags": [
      "unresolved"
    ],
    "override": null,
    "unresolved_reason": "no_capture_leq_version_end"
  },
  {
    "version_id": "1.0B",
    "target_end_date": "2020-11-10",
    "selected_timestamp": "20201101014348",
    "archive_url": "https://web.archive.org/web/20201101014348/https://game8.co/games/Genshin-Impact/archives/297465",
    "selection_reason": "latest_leq_end_date",
    "quality_flags": [],
    "override": null,
    "unresolved_reason": null
  },
  {
    "version_id": "1.1A",
    "target_end_date": "2020-11-30",
    "selected_timestamp": "20201101014348",
    "archive_url": "https://web.archive.org/web/20201101014348/https://game8.co/games/Genshin-Impact/archives/297465",
    "selection_reason": "latest_leq_end_date",
    "quality_flags": [],
    "override": null,
    "unresolved_reason": null
  },
  {
    "version_id": "1.1B",
    "target_end_date": "2020-12-22",
    "selected_timestamp": "20201202033735",
    "archive_url": "https://web.archive.org/web/20201202033735/https://game8.co/games/Genshin-Impact/archives/297465",
    "selection_reason": "latest_leq_end_date",
    "quality_flags": [],
    "override": null,
    "unresolved_reason": null
  },
  {
    "version_id": "1.2A",
    "target_end_date": "2021-01-11",
    "selected_timestamp": "20201230032659",
    "archive_url": "https://web.archive.org/web/20201230032659/https://game8.co/games/Genshin-Impact/archives/297465",
    "selection_reason": "latest_leq_end_date",
    "quality_flags": [],
    "override": null,
    "unresolved_reason": null
  },
  {
    "version_id": "1.2B",
    "target_end_date": "2021-02-02",
    "selected_timestamp": "20210127000927",
    "archive_url": "https://web.archive.org/web/20210127000927/https://game8.co/games/Genshin-Impact/archives/297465",
    "selection_reason": "latest_leq_end_date",
    "quality_flags": [],
    "override": null,
    "unresolved_reason": null
  },
  {
    "version_id": "1.3A",
    "target_end_date": "2021-03-01",
    "selected_timestamp": "20210222062458",
    "archive_url": "https://web.archive.org/web/20210222062458/https://game8.co/games/Genshin-Impact/archives/297465",
    "selection_reason": "latest_leq_end_date",
    "quality_flags": [],
    "override": null,
    "unresolved_reason": null
  },
  {
    "version_id": "1.3B",
    "target_end_date": "2021-04-05",
    "selected_timestamp": "20210404042226",
    "archive_url": "https://web.archive.org/web/20210404042226/https://game8.co/games/Genshin-Impact/archives/297465",
    "selection_reason": "latest_leq_end_date",
    "quality_flags": [],
    "override": null,
    "unresolved_reason": null
  },
  {
    "version_id": "1.4B",
    "target_end_date": "2021-04-27",
    "selected_timestamp": "20210414044406",
    "archive_url": "https://web.archive.org/web/20210414044406/https://game8.co/games/Genshin-Impact/archives/297465",
    "selection_reason": "latest_leq_end_date",
    "quality_flags": [],
    "override": null,
    "unresolved_reason": null
  },
  {
    "version_id": "1.5A",
    "target_end_date": "2021-05-17",
    "selected_timestamp": "20210429054907",
    "archive_url": "https://web.archive.org/web/20210429054907/https://game8.co/games/Genshin-Impact/archives/297465",
    "selection_reason": "latest_leq_end_date",
    "quality_flags": [],
    "override": null,
    "unresolved_reason": null
  },
  {
    "version_id": "1.5B",
    "target_end_date": "2021-06-28",
    "selected_timestamp": "20210623143325",
    "archive_url": "https://web.archive.org/web/20210623143325/https://game8.co/games/Genshin-Impact/archives/297465",
    "selection_reason": "latest_leq_end_date",
    "quality_flags": [],
    "override": null,
    "unresolved_reason": null
  },
  {
    "version_id": "1.6B",
    "target_end_date": "2021-07-20",
    "selected_timestamp": "20210716023712",
    "archive_url": "https://web.archive.org/web/20210716023712/https://game8.co/games/Genshin-Impact/archives/297465",
    "selection_reason": "latest_leq_end_date",
    "quality_flags": [],
    "override": null,
    "unresolved_reason": null
  },
  {
    "version_id": "2.0A",
    "target_end_date": "2021-08-09",
    "selected_timestamp": "20210722011759",
    "archive_url": "https://web.archive.org/web/20210722011759/https://game8.co/games/Genshin-Impact/archives/297465",
    "selection_reason": "latest_leq_end_date",
    "quality_flags": [],
    "override": null,
    "unresolved_reason": null
  },
  {
    "version_id": "2.0B",
    "target_end_date": "2021-08-31",
    "selected_timestamp": "20210824184055",
    "archive_url": "https://web.archive.org/web/20210824184055/https://game8.co/games/Genshin-Impact/archives/297465",
    "selection_reason": "latest_leq_end_date",
    "quality_flags": [],
    "override": null,
    "unresolved_reason": null
  },
  {
    "version_id": "2.1A",
    "target_end_date": "2021-09-20",
    "selected_timestamp": "20210919193625",
    "archive_url": "https://web.archive.org/web/20210919193625/https://game8.co/games/Genshin-Impact/archives/297465",
    "selection_reason": "latest_leq_end_date",
    "quality_flags": [],
    "override": null,
    "unresolved_reason": null
  },
  {
    "version_id": "2.1B",
    "target_end_date": "2021-11-01",
    "selected_timestamp": "20211023210616",
    "archive_url": "https://web.archive.org/web/20211023210616/https://game8.co/games/Genshin-Impact/archives/297465",
    "selection_reason": "latest_leq_end_date",
    "quality_flags": [],
    "override": null,
    "unresolved_reason": null
  },
  {
    "version_id": "2.2B",
    "target_end_date": "2021-12-13",
    "selected_timestamp": "20211201224736",
    "archive_url": "https://web.archive.org/web/20211201224736/https://game8.co/games/Genshin-Impact/archives/297465",
    "selection_reason": "latest_leq_end_date",
    "quality_flags": [],
    "override": null,
    "unresolved_reason": null
  },
  {
    "version_id": "2.3B",
    "target_end_date": "2022-01-04",
    "selected_timestamp": "20220101205653",
    "archive_url": "https://web.archive.org/web/20220101205653/https://game8.co/games/Genshin-Impact/archives/297465",
    "selection_reason": "latest_leq_end_date",
    "quality_flags": [],
    "override": null,
    "unresolved_reason": null
  },
  {
    "version_id": "2.4A",
    "target_end_date": "2022-02-15",
    "selected_timestamp": "20220214095929",
    "archive_url": "https://web.archive.org/web/20220214095929/https://game8.co/games/Genshin-Impact/archives/297465",
    "selection_reason": "latest_leq_end_date",
    "quality_flags": [],
    "override": null,
    "unresolved_reason": null
  },
  {
    "version_id": "2.5A",
    "target_end_date": "2022-03-29",
    "selected_timestamp": "20220324072544",
    "archive_url": "https://web.archive.org/web/20220324072544/https://game8.co/games/Genshin-Impact/archives/297465",
    "selection_reason": "latest_leq_end_date",
    "quality_flags": [],
    "override": null,
    "unresolved_reason": null
  },
  {
    "version_id": "2.6A",
    "target_end_date": "2022-05-30",
    "selected_timestamp": "20220528201229",
    "archive_url": "https://web.archive.org/web/20220528201229/https://game8.co/games/Genshin-Impact/archives/297465",
    "selection_reason": "latest_leq_end_date",
    "quality_flags": [],
    "override": null,
    "unresolved_reason": null
  },
  {
    "version_id": "2.7A",
    "target_end_date": "2022-06-20",
    "selected_timestamp": "20220601032957",
    "archive_url": "https://web.archive.org/web/20220601032957/https://game8.co/games/Genshin-Impact/archives/297465",
    "selection_reason": "latest_leq_end_date",
    "quality_flags": [],
    "override": null,
    "unresolved_reason": null
  },
  {
    "version_id": "2.7B",
    "target_end_date": "2022-07-12",
    "selected_timestamp": "20220701182332",
    "archive_url": "https://web.archive.org/web/20220701182332/https://game8.co/games/Genshin-Impact/archives/297465",
    "selection_reason": "latest_leq_end_date",
    "quality_flags": [],
    "override": null,
    "unresolved_reason": null
  },
  {
    "version_id": "2.8A",
    "target_end_date": "2022-08-23",
    "selected_timestamp": "20220819191446",
    "archive_url": "https://web.archive.org/web/20220819191446/https://game8.co/games/Genshin-Impact/archives/297465",
    "selection_reason": "latest_leq_end_date",
    "quality_flags": [],
    "override": null,
    "unresolved_reason": null
  },
  {
    "version_id": "3.0A",
    "target_end_date": "2022-09-08",
    "selected_timestamp": "20220831200110",
    "archive_url": "https://web.archive.org/web/20220831200110/https://game8.co/games/Genshin-Impact/archives/297465",
    "selection_reason": "latest_leq_end_date",
    "quality_flags": [],
    "override": null,
    "unresolved_reason": null
  },
  {
    "version_id": "3.0B",
    "target_end_date": "2022-09-27",
    "selected_timestamp": "20220924194313",
    "archive_url": "https://web.archive.org/web/20220924194313/https://game8.co/games/Genshin-Impact/archives/297465",
    "selection_reason": "latest_leq_end_date",
    "quality_flags": [],
    "override": null,
    "unresolved_reason": null
  },
  {
    "version_id": "3.1A",
    "target_end_date": "2022-10-13",
    "selected_timestamp": "20221013095809",
    "archive_url": "https://web.archive.org/web/20221013095809/https://game8.co/games/Genshin-Impact/archives/297465",
    "selection_reason": "latest_leq_end_date",
    "quality_flags": [],
    "override": null,
    "unresolved_reason": null
  },
  {
    "version_id": "3.1B",
    "target_end_date": "2022-11-01",
    "selected_timestamp": "20221018201145",
    "archive_url": "https://web.archive.org/web/20221018201145/https://game8.co/games/Genshin-Impact/archives/297465",
    "selection_reason": "latest_leq_end_date",
    "quality_flags": [],
    "override": null,
    "unresolved_reason": null